,coarse_label,coarse_definition
0,arts,"The arts are a very wide range of human practices of creative expression, storytelling and cultural participation. They encompass multiple diverse and plural modes of thinking, doing and being, in an extremely broad range of media."
1,business,"Business is the practice of making one's living or making money by producing or buying and selling products (such as goods and services). It is also ""any activity or enterprise entered into for profit."""
2,politics,"Politics is the set of activities that are associated with making decisions in groups, or other forms of power relations among individuals, such as the distribution of resources or status. The branch of social science that studies politics and government is referred to as political science."
3,science,Science is a systematic endeavor that builds and organizes knowledge in the form of testable explanations and predictions about the universe.
4,sports,"Sport pertains to any form of competitive physical activity or game that aims to use, maintain, or improve physical ability and skills while providing enjoyment to participants and, in some cases, entertainment to spectators. Sports can, through casual or organized participation, improve participants' physical health."
